{
  "$schema": "https://json-schema.org/draft/2020-12/schema",
  "$id": "https://github.com/FaithMediaAI/OpenHymns/schemas/hymn.schema.json",
  "title": "OpenHymns Hymn",
  "type": "object",
  "required": [
    "schemaVersion",
    "id",
    "collectionId",
    "language",
    "title",
    "sections",
    "searchText",
    "source"
  ],
  "properties": {
    "schemaVersion": {
      "const": 1
    },
    "id": {
      "type": "string"
    },
    "collectionId": {
      "type": "string"
    },
    "language": {
      "type": "string"
    },
    "number": {
      "type": "string"
    },
    "title": {
      "type": "string"
    },
    "authors": {
      "type": "array",
      "items": {
        "type": "string"
      }
    },
    "tune": {
      "type": "string"
    },
    "meter": {
      "type": "string"
    },
    "topics": {
      "type": "array",
      "items": {
        "type": "string"
      }
    },
    "sections": {
      "type": "array",
      "items": {
        "type": "object",
        "required": [
          "type",
          "label",
          "lines"
        ],
        "properties": {
          "type": {
            "enum": [
              "verse",
              "chorus",
              "bridge"
            ]
          },
          "label": {
            "type": "string"
          },
          "lines": {
            "type": "array",
            "items": {
              "type": "string"
            }
          }
        }
      }
    },
    "searchText": {
      "type": "string"
    },
    "source": {
      "type": "object",
      "required": [
        "repo",
        "path",
        "license",
        "rightsStatus"
      ],
      "properties": {
        "repo": {
          "type": "string"
        },
        "path": {
          "type": "string"
        },
        "license": {
          "type": "string"
        },
        "rightsStatus": {
          "type": "string"
        }
      }
    },
    "titleSource": {
      "enum": [
        "first-line",
        "number-prefix-removed",
        "missing"
      ]
    },
    "sourceTitle": {
      "type": "string"
    },
    "contentStatus": {
      "enum": [
        "missing-lyrics"
      ]
    },
    "canonicalId": {
      "type": "string"
    },
    "collectionIds": {
      "type": "array",
      "minItems": 1,
      "uniqueItems": true,
      "items": {
        "type": "string"
      }
    },
    "alternateTitles": {
      "type": "array",
      "uniqueItems": true,
      "items": {
        "type": "string"
      }
    },
    "references": {
      "type": "array",
      "minItems": 1,
      "items": {
        "type": "object",
        "required": [
          "id",
          "collectionId",
          "language",
          "number",
          "title",
          "source"
        ],
        "properties": {
          "id": {
            "type": "string"
          },
          "collectionId": {
            "type": "string"
          },
          "language": {
            "type": "string"
          },
          "number": {
            "type": "string"
          },
          "title": {
            "type": "string"
          },
          "source": {
            "$ref": "#/properties/source"
          }
        }
      }
    }
  }
}
