[
  {
    "collectionId": "cis-tumbuka",
    "contentStatus": "missing-lyrics",
    "id": "cis-tumbuka-051-untitled",
    "language": "tum",
    "number": "51",
    "schemaVersion": 1,
    "searchText": "untitled 51",
    "sections": [],
    "source": {
      "license": "NOASSERTION",
      "path": "v2/tumbuka/tumbuka.json",
      "repo": "TinasheMzondiwa/cis-hymnals",
      "rightsStatus": "source-repository"
    },
    "sourceTitle": "",
    "title": "Untitled",
    "titleSource": "missing"
  },
  {
    "collectionId": "cis-tumbuka",
    "contentStatus": "missing-lyrics",
    "id": "cis-tumbuka-066-untitled",
    "language": "tum",
    "number": "66",
    "schemaVersion": 1,
    "searchText": "untitled 66",
    "sections": [],
    "source": {
      "license": "NOASSERTION",
      "path": "v2/tumbuka/tumbuka.json",
      "repo": "TinasheMzondiwa/cis-hymnals",
      "rightsStatus": "source-repository"
    },
    "sourceTitle": "",
    "title": "Untitled",
    "titleSource": "missing"
  },
  {
    "collectionId": "cis-tumbuka",
    "contentStatus": "missing-lyrics",
    "id": "cis-tumbuka-250-untitled",
    "language": "tum",
    "number": "250",
    "schemaVersion": 1,
    "searchText": "untitled 250",
    "sections": [],
    "source": {
      "license": "NOASSERTION",
      "path": "v2/tumbuka/tumbuka.json",
      "repo": "TinasheMzondiwa/cis-hymnals",
      "rightsStatus": "source-repository"
    },
    "sourceTitle": "",
    "title": "Untitled",
    "titleSource": "missing"
  },
  {
    "collectionId": "cis-tumbuka",
    "contentStatus": "missing-lyrics",
    "id": "cis-tumbuka-266-untitled",
    "language": "tum",
    "number": "266",
    "schemaVersion": 1,
    "searchText": "untitled 266",
    "sections": [],
    "source": {
      "license": "NOASSERTION",
      "path": "v2/tumbuka/tumbuka.json",
      "repo": "TinasheMzondiwa/cis-hymnals",
      "rightsStatus": "source-repository"
    },
    "sourceTitle": "",
    "title": "Untitled",
    "titleSource": "missing"
  },
  {
    "collectionId": "cis-tumbuka",
    "contentStatus": "missing-lyrics",
    "id": "cis-tumbuka-355-untitled",
    "language": "tum",
    "number": "355",
    "schemaVersion": 1,
    "searchText": "untitled 355",
    "sections": [],
    "source": {
      "license": "NOASSERTION",
      "path": "v2/tumbuka/tumbuka.json",
      "repo": "TinasheMzondiwa/cis-hymnals",
      "rightsStatus": "source-repository"
    },
    "sourceTitle": "",
    "title": "Untitled",
    "titleSource": "missing"
  },
  {
    "collectionId": "cs1900",
    "contentStatus": "missing-lyrics",
    "id": "cs1900-002-untitled",
    "language": "en",
    "number": "2",
    "schemaVersion": 1,
    "searchText": "untitled 2",
    "sections": [],
    "source": {
      "license": "NOASSERTION",
      "path": "CS1900/index.json#songs.1",
      "repo": "GospelSounders/hymnals-data",
      "rightsStatus": "source-repository"
    },
    "sourceTitle": "",
    "title": "Untitled",
    "titleSource": "missing"
  },
  {
    "collectionId": "sdah",
    "contentStatus": "missing-lyrics",
    "id": "sdah-697-untitled",
    "language": "en",
    "number": "697",
    "schemaVersion": 1,
    "searchText": "untitled 697",
    "sections": [],
    "source": {
      "license": "NOASSERTION",
      "path": "SDAH/index.json#songs.695",
      "repo": "GospelSounders/hymnals-data",
      "rightsStatus": "source-repository"
    },
    "sourceTitle": "",
    "title": "Untitled",
    "titleSource": "missing"
  },
  {
    "collectionId": "sdah",
    "contentStatus": "missing-lyrics",
    "id": "sdah-698-untitled",
    "language": "en",
    "number": "698",
    "schemaVersion": 1,
    "searchText": "untitled 698",
    "sections": [],
    "source": {
      "license": "NOASSERTION",
      "path": "SDAH/index.json#songs.696",
      "repo": "GospelSounders/hymnals-data",
      "rightsStatus": "source-repository"
    },
    "sourceTitle": "",
    "title": "Untitled",
    "titleSource": "missing"
  },
  {
    "collectionId": "sdah",
    "contentStatus": "missing-lyrics",
    "id": "sdah-699-untitled",
    "language": "en",
    "number": "699",
    "schemaVersion": 1,
    "searchText": "untitled 699",
    "sections": [],
    "source": {
      "license": "NOASSERTION",
      "path": "SDAH/index.json#songs.697",
      "repo": "GospelSounders/hymnals-data",
      "rightsStatus": "source-repository"
    },
    "sourceTitle": "",
    "title": "Untitled",
    "titleSource": "missing"
  },
  {
    "collectionId": "sdah",
    "contentStatus": "missing-lyrics",
    "id": "sdah-700-untitled",
    "language": "en",
    "number": "700",
    "schemaVersion": 1,
    "searchText": "untitled 700",
    "sections": [],
    "source": {
      "license": "NOASSERTION",
      "path": "SDAH/index.json#songs.698",
      "repo": "GospelSounders/hymnals-data",
      "rightsStatus": "source-repository"
    },
    "sourceTitle": "",
    "title": "Untitled",
    "titleSource": "missing"
  },
  {
    "collectionId": "sdah",
    "contentStatus": "missing-lyrics",
    "id": "sdah-701-untitled",
    "language": "en",
    "number": "701",
    "schemaVersion": 1,
    "searchText": "untitled 701",
    "sections": [],
    "source": {
      "license": "NOASSERTION",
      "path": "SDAH/index.json#songs.699",
      "repo": "GospelSounders/hymnals-data",
      "rightsStatus": "source-repository"
    },
    "sourceTitle": "",
    "title": "Untitled",
    "titleSource": "missing"
  },
  {
    "collectionId": "sdah",
    "contentStatus": "missing-lyrics",
    "id": "sdah-702-untitled",
    "language": "en",
    "number": "702",
    "schemaVersion": 1,
    "searchText": "untitled 702",
    "sections": [],
    "source": {
      "license": "NOASSERTION",
      "path": "SDAH/index.json#songs.700",
      "repo": "GospelSounders/hymnals-data",
      "rightsStatus": "source-repository"
    },
    "sourceTitle": "",
    "title": "Untitled",
    "titleSource": "missing"
  },
  {
    "collectionId": "sdah",
    "contentStatus": "missing-lyrics",
    "id": "sdah-703-untitled",
    "language": "en",
    "number": "703",
    "schemaVersion": 1,
    "searchText": "untitled 703",
    "sections": [],
    "source": {
      "license": "NOASSERTION",
      "path": "SDAH/index.json#songs.701",
      "repo": "GospelSounders/hymnals-data",
      "rightsStatus": "source-repository"
    },
    "sourceTitle": "",
    "title": "Untitled",
    "titleSource": "missing"
  },
  {
    "collectionId": "sdah",
    "contentStatus": "missing-lyrics",
    "id": "sdah-704-untitled",
    "language": "en",
    "number": "704",
    "schemaVersion": 1,
    "searchText": "untitled 704",
    "sections": [],
    "source": {
      "license": "NOASSERTION",
      "path": "SDAH/index.json#songs.702",
      "repo": "GospelSounders/hymnals-data",
      "rightsStatus": "source-repository"
    },
    "sourceTitle": "",
    "title": "Untitled",
    "titleSource": "missing"
  },
  {
    "collectionId": "sdah",
    "contentStatus": "missing-lyrics",
    "id": "sdah-705-untitled",
    "language": "en",
    "number": "705",
    "schemaVersion": 1,
    "searchText": "untitled 705",
    "sections": [],
    "source": {
      "license": "NOASSERTION",
      "path": "SDAH/index.json#songs.703",
      "repo": "GospelSounders/hymnals-data",
      "rightsStatus": "source-repository"
    },
    "sourceTitle": "",
    "title": "Untitled",
    "titleSource": "missing"
  },
  {
    "collectionId": "sdah",
    "contentStatus": "missing-lyrics",
    "id": "sdah-706-untitled",
    "language": "en",
    "number": "706",
    "schemaVersion": 1,
    "searchText": "untitled 706",
    "sections": [],
    "source": {
      "license": "NOASSERTION",
      "path": "SDAH/index.json#songs.704",
      "repo": "GospelSounders/hymnals-data",
      "rightsStatus": "source-repository"
    },
    "sourceTitle": "",
    "title": "Untitled",
    "titleSource": "missing"
  },
  {
    "collectionId": "sdah",
    "contentStatus": "missing-lyrics",
    "id": "sdah-707-untitled",
    "language": "en",
    "number": "707",
    "schemaVersion": 1,
    "searchText": "untitled 707",
    "sections": [],
    "source": {
      "license": "NOASSERTION",
      "path": "SDAH/index.json#songs.705",
      "repo": "GospelSounders/hymnals-data",
      "rightsStatus": "source-repository"
    },
    "sourceTitle": "",
    "title": "Untitled",
    "titleSource": "missing"
  },
  {
    "collectionId": "sdah",
    "contentStatus": "missing-lyrics",
    "id": "sdah-708-untitled",
    "language": "en",
    "number": "708",
    "schemaVersion": 1,
    "searchText": "untitled 708",
    "sections": [],
    "source": {
      "license": "NOASSERTION",
      "path": "SDAH/index.json#songs.706",
      "repo": "GospelSounders/hymnals-data",
      "rightsStatus": "source-repository"
    },
    "sourceTitle": "",
    "title": "Untitled",
    "titleSource": "missing"
  },
  {
    "collectionId": "sdah",
    "contentStatus": "missing-lyrics",
    "id": "sdah-709-untitled",
    "language": "en",
    "number": "709",
    "schemaVersion": 1,
    "searchText": "untitled 709",
    "sections": [],
    "source": {
      "license": "NOASSERTION",
      "path": "SDAH/index.json#songs.707",
      "repo": "GospelSounders/hymnals-data",
      "rightsStatus": "source-repository"
    },
    "sourceTitle": "",
    "title": "Untitled",
    "titleSource": "missing"
  },
  {
    "collectionId": "sdah",
    "contentStatus": "missing-lyrics",
    "id": "sdah-710-untitled",
    "language": "en",
    "number": "710",
    "schemaVersion": 1,
    "searchText": "untitled 710",
    "sections": [],
    "source": {
      "license": "NOASSERTION",
      "path": "SDAH/index.json#songs.708",
      "repo": "GospelSounders/hymnals-data",
      "rightsStatus": "source-repository"
    },
    "sourceTitle": "",
    "title": "Untitled",
    "titleSource": "missing"
  },
  {
    "collectionId": "sdah",
    "contentStatus": "missing-lyrics",
    "id": "sdah-711-untitled",
    "language": "en",